<?xml version="1.0" encoding="UTF-8"?>
<!DOCTYPE compass2-config SYSTEM "compass2-config.dtd" >
<compass2-config>

	<system-config>
	    <full-text-search>
			<full-text-search-implementation class="${no.ovitas.compass2.service.FTSImplementation}" >
				<params>
					<param name="indexdirectory-path" value="${lucene.spellchecker.index.dir}"/>
					<param name="max-hits-per-query " value="${lucene.fts.max.hits.per.query}"/>
				</params>
			</full-text-search-implementation>
       		  
			<content-indexer-implementation class="${no.ovitas.compass2.service.fts.ContentIndexerImplementation}" />
			<document-repository path="${document.repository}" />
		</full-text-search>
		
		<knowledge-base>
			<knowlegde-base-implementation class="${no.ovitas.compass2.service.KBImplementation}" >
				<params>
					<param name="file-path" value="${knowledge.base.file}"/>
					<param name="load-on-startup" value="${knowladge.base.load.on.startup}"/>
				</params>
			</knowlegde-base-implementation>
		</knowledge-base>
		
		<language-tools>
			<language-tools-implementation class="${no.ovitas.compass2.service.LTImplementation}">
				<params>
					<param name="snowball-language" value="English"/>
					<param name="lucene-spellchecker-directory" value="${lucene.spellchecker.dir}"/>
					<param name="lucene-spellchecker-index-directory" value="${lucene.spellchecker.index.dir}"/>
					<param name="lucene-spellchecker-index-directory" value="${lucene.spellchecker.index.dir}"/>
					<param name="lucene-spellchecker-field" value="word"/>
					<param name="lucene-spellchecker-max-suggestion-num" value="${lucene.spellchecker.max.suggestion.num}"/>
				</params>
			</language-tools-implementation>
		</language-tools>
	</system-config>
  
	<search-config>
		<use-random-weigth value="${use.random.weight}"/>
		<max-topic-number-to-expand value="${max.topic.number.to.expand}" />
		
		<relation-types>
			<relation-type id="#123456" weight="0.5" generalization-weight="0.73" />
		</relation-types>
	</search-config>
	
</compass2-config>
